RIN,Title,Journal ,Alternate Source,Author,Affiliation,Date,Type,DOI,ISSN ,Abstract,Government Funding,Funding Source,Notes,,0910-AC34,"The Value of Reducing Risks of Death: A Note on NewEvidence",Journal of Policy Analysis and Management,,"Fisher, A; et al.","U.S. Environmental Protection Agency; RCG/Hagler, Baily, Inc.",1989,Scholarly Journal,10.2307/3324426,0276-8739,"Government agencies face difficult resource-allocation decisions when confronted with projects that will reduce risks of fatality. Evidence from individual behavior helps determine society's values for reducing risks. The most credible evidence is based on individuals' willingness to pay (or willingness to accept compensation) for small changes in risks. Studies of consumer behavior are limited, but more evidence is available relating wages to job risks. Contingent valuation studies reinforce the wage-risk implications, leading to a range of values that can be compared with the costs of proposals to reduce fatal risks.",,U.S. Environmental Protection Agency,Grant number 68-01-7047,,0910-AC34,Costs and Benefits of Smoking Restrictions: An Assessment of the Smoke-Free Environment Act of 1993,,Environmental Protection Agnecy,"Mudarri, D.",,1994,RIA,,,,,,Sounds like an RIA,,0910-AC34,"Surveillance, Epidemiology, and End Results (SEER) Cancer Statistics Review (1973_1994), Annual",,,U.S. National Cancer Institute,,1997,Government Report,,,,,,,,0910-AC34,Cost of Breast Cancer Treatment,Archives of Internal Medicine,,"Legoretta, A. et al.",,1996,Article,,,,,,,,0910-AC34,The Economic Burden of Cancer,Cancer Prevention and Control,,"Brown, M.; Fintor, L.","Marcel Dekker, Inc.",1995,Article,,,,,,,,0910-AC34,Health Status: Types of Validity and the Index of Well- Being,Health Service Research,,"Kaplan, R.; et al.",University of California San Diego; California State University San Diego,1976,Scholarly Journal,, 0017-9124,"The concept of validity as it applies to measures of health and health status is examined in the context of a set of standard, widely accepted definitions of validity. Criterion validity is shown to be irrelevant to health status measures because of the lack of a single specific, directly observable measure of health for use as a criterion. To overcome this problem, the Index of Well-being has been constructed to fulfill the definition of content validity by including all levels of function and symptom/problem complexes, a clearly defined relation to the death state, and consumer ratings of the relative desirability of the function levels. Data from a two-wave household interview survey provide convergent evidence of construct validity by demonstrating an expected positive correlation of the Index of Well-being with self-rated well-being and expected negative correlations with age, number of chronic medical conditions, number of reported symptoms or problems, number of physician contacts, and dysfunctional status. Discriminant evidence of construct validity is demonstrated by predicted differences in correlation between concurrent Index of Well-being scores and self-assessed overall health status, and between the Index of Well-being scores and self-rated well-being on different days. A simple method of estimating a currently usable comprehensive population index of health status, the Weighted Life Expectancy, is described.",,National Center for Health Services Research,DOI not found; possible explanation is the article is from 1976,,0910-AC34,The CES-D Scale: A Self-Report Depression Scale for Research in the General Population,The Journal of Applied Psychological Measurement,,"Radloff, L.",,1977,Article,,,,,,,,0910-AC34,Scaling of Stressful Life Events,,Stressful Life Events and Their Contexts,"Shrout, P.",,1984,Article,,,,,,,,0910-AC34,Social Indicators for Health Planning and Policy Analysis,Policy Sciences,,"Chen, M.; et al.",California State University; University of California San Diego; Yale University,1975,Scholarly Journal,10.1007/BF00186756,0032-2687,"The concept of health involves two dimensions: The level of function at a point in time and the probability of transition to other levels at future times. By applying measured social values to the distribution of the population among a set of levels, a Function Status Index aptly summarizes the Level-of-Well-Being of a population at a point in time. By incorporating empirically determined transition probabilities into a simple stochastic model, a Quality-Adjusted Life Expectancy can be computed that approximates a comprehensive social indicator for health. The indicators possess the statistical properties required for time series and interpopulation comparisons, for studying outcomes and quality of medical care, and for health system optimization in planning and policy analysis.",,Bureau of Health Services Research,info found at http://link.springer.com/article/10.1007/BF00186756,,0910-AC34,"Expectation of Life and Expected Death by Race, Sex, and Age",,Vital Statistics of the United States,U.S. National Center for Health Statistics,,1995,Government Report,,,,,,,,0910-AC34,Estimating the Cost to Society of Consumer Product Injuries,,,U.S. Consumer Product Safety Commission,National Public Services Research Institute,Jan-98,Government Report,,,,,,,,0910-AC34,"Health-Related Quality of Life Measurement forEvaluation Research and Policy Analysis",Health Psychology,,"Kaplan, R.; Bush, J.",,1982,Article,,,,,,,,0910-AC34,Compliance Testing Program,,,Food and Drug Administration,,"January 1, 1996 to December 31, 2000",Government Report,,,,,,series of data referred to by the RIA,,0910-AC34,Manufacturing Industry Series report on Irradiation Apparatus Manufacturing for NAICS code 334517,,1997 Economic Census,Manufacturing Industry Series,,1997,Government Report,,,,,,,,,,,,,,,,,,,,,,,0910-AF18,Guidance for Industry: Integration of Dose-Counting Mechanisms into MDI Drug Products,,,U.S. Food and Drug Administration,,Mar-93,Government Report,,,,,,,,0910-AF18,Accuracy of Float Testing for Metered-Dose Inhaler Canisters,Journal of the American Pharmaceutical Association,,"Penick, Brock T.; et al",,July/August 2002,Article,,,,,,,,0910-AF18,Prospective Observational Cohort Safety Study to Monitor the Introduction of a Non-CFC Formulation of Salbutamol with HFA 134a in England,International Journal of Clinical Pharmacology and Therapeutics,,"Craig-McFeely, P.M.; et al.",Drug Safety Research Unit; GlaxoSmithKline; London School of Hygiene,3-Feb,Scholarly Journal,10.5414/CPP41067, 0946-1965,"Objective: To monitor the safety of a salbutamol MDI with a hydrofluoroalkane propellant (Ventolin Evohaler) during its introduction into primary care use in England. Methods: Prospective observational cohort study. 1,365 GPs in England submitted data on 10,472 regular users of Ventolin MDI, over five 3-month periods of observation between October 1, 1998 and December 31, 1999. The primary aim was to compare event rates occurring before and after the introduction of Ventolin Evohaler. The secondary aim was a comparison of event rates between users of Ventolin Evohaler and Ventolin MDI. The main outcome measures were: indication for use of Ventolin MDI, assessment of disease severity, event rates during each period of observation; deaths, pregnancies, reported adverse drug reactions and reasons for discontinuation of MDI. Event rates were adjusted using a ratio for under-reporting derived from a validation study on 4.6% of the study population and stratified by severity of indication. Results: The primary indication was asthma in 94%, distributed by severity as 47% mild, 44% moderate and 9% severe; 13% were children. By October 1999, 52.7% of the 8,973 remaining patients had transitioned to Ventolin Evohaler. There was no increase in major or minor events observed following the introduction of Ventolin Evohaler. No serious adverse events, abnormal pregnancy outcomes or deaths have been related to Ventolin MDI or Ventolin Evohaler. The validation study showed a degree of under-reporting. Conclusion: These results on a large cohort of community patients in England indicate that Ventolin Evohaler is well tolerated among asthmatics.",,,"Could not access on Umass page, found using ResearchGate unable to find funder",,0910-AF18,Pharmacy Benefits and the Use of Drugs by the Chronically Ill,The Journal of the America Medical Association,,"Goldman, J.; et al.",,4-May,Article,, ,,,,This is actually a scholarly journal that I had misinterpreted. See database,,0910-AF18,Production and Consumption of Ozone-Depleting Substances 1986-2000,,,United Nations Environmental Programme,,2003,Government Report,,,,,,UN,,0910-AF18,The Benefits and Costs of the Clean Air Act: 1990-2010,,,U.S. Environmental Protection Agency,,Oct-97,RIA,,,,,,,,0910-AF18,"Chronic Obstructive Pulmonary Disease Surveillance--United States, 1971-2000",Morbidity and Mortality Weekly Report,,Mannino D.M.; et al.,,2-Aug,Article,,,,,,,,0910-AF18,Trends in Asthma Morbidity and Mortality,,,American Lung Association,"Epidemiology & Statistics Unit, Research and Scientific Affairs",4-Apr,Non-Government Report,,,,,,,,0910-AF18,"Surveillance for Asthma--United States, 1980-1999",Morbidity and Mortality Weekly Report,,Mannino D.M.; et al.,,2-Mar,Article,,,,,,,,0910-AF18,"IMS National Prescription AuditTM, 2004; IMS Health, IMS MIDASTM, Q1/2004_-Q2/2004",,IMS Health,Food and Drug Administration,,2004,Government Report,,,,,,"""Analysis completed by FDA based on information provided by IMS Health""",,0910-AF18,Economics Issues Raised in the FDA's Proposed Rule on Removing the Essential-Use Designation for Albuterol MDIs,,,"Rozek, R.P.; Bishko, E.R.",National Economic Research Associates,4-Aug,Comment,,,,,,refers to FDA Docket No. 2003P-0029/C25,,0910-AF18,"Albuterol Inhalers: Prescriptions per User, Price per Prescription and Expenditure Given Use",,,Agency for Healthcare Research and Quality,,9-Jun,Government Report,,,,,,,,0910-AF18,The Elasticity of Demand for Health Care,,,"Ringel, J.S.; et al","National Defense Research Institute, Rand Health",2002,Government Report,,,,,,actually a book; see database,,0910-AF18,"Income, Poverty, and Health Insurance Coverage in the United States: 2003",,Current Population Reports,U.S. Census Bureau,U.S. Department of Commerce,4-Aug,Government Report,,,,,,,,0910-AF18,Sample Medication Dispensing in a Residency Practice,Journal of Family Practice,,"Morelli, D.; Koenigsberg, M.R.",State University of New York Buffalo,1992,Scholarly Journal,,0094-3509,"Background. The distribution of sample medications to physicians by pharmaceutical manufacturers has been regulated by Congress and extensively critiqued in the medical literature. Manufacturers distributed 2.4 billion samples in 1988, yet there are no published reports on die clinical use of sample medications. Methods. A 4-week descriptive study was conducted that catalogued the contents of a sample medication collection in a family practice residency model office, calculated the value of the sample collection (average wholesale price [AWP]), and monitored dispensing of medication samples. Results. The collection initially contained 5546 samples with an AWP of $19,273. A total of 1012 samples worth $4154 was withdrawn from the collection during the study period. Patients received 548 of the sample packages in 105 dispensements ($2583), physicians or their families received 169 samples in 44 dispensements ($603), others received 26 samples in 6 dispensements ($152), and the destination of 269 samples ($816) was unknown. When a prescription was written at the time that a sample was dispensed, it was almost always for the same brand-name medication. Conclusions. Although a majority of medications dispensed were given to patients, approximately one third of the value of the medications withdrawn either went to physicians and their families or had an unknown destination. The high association of sample dispensing and simultaneous prescribing of the same brand-name drug supports the contention that sampling influences physician-prescribing habits. Further research should define how the availability of free sample medications affect physician-prescribing practices.",,,Could not find in Journal logs; unable to find doi,,0910-AF18,Disposition of Pharmaceutical Samples from a Private Medical Clinic,Journal of the American Pharmacists Association,,"Peterson, M.C.; et al",,2004,Article,,,,,,,,0910-AF18,Guidance on Proper Consideration of Small Entities in Rulemakings of the U.S. Department of Health and Human Services,,,U.S. Department of Health & Human Services,,3-May,Government Report,,,,,,,,0910-AF18,How Increased Competition from Generic Drugs Has Affected Prices and Returns in the Pharmaceutical Industry,,,Congressional Budget Office,,Jul-98,Government Report,,,,,,,,0910-AF18,43 FR 11301,,,Food and Drug Administration; Environmental Protection Agency,,Mar-78,Regulation,,,,,,,,0910-AF18,42 FR 22018,,,Food and Drug Administration; Consumer Product Safety Commission ,,Apr-77,Regulation,,,,,,,,0910-AF18,43 FR 11318,,,Food and Drug Administration; Environmental Protection Agency,,Mar-78,Regulation,,,,,,,,0910-AF18,42 FR 42780,,,Food and Drug Administration; Consumer Product Safety Commission ,,Aug-77,Regulation,,,,,,,,0910-AF18,Montreal Protocol on Substances that Deplete the Ozone Layer,,,Ozone Secretariat, United Nations Environmental Programme,Sep-87,Other,,,,,,UN Protocol; link provided: http://www.unep.org/ozone/pdfs/Montreal- Protocol2000.pdf,,0910-AF18,Decision VIII/10 ,,,Ozone Secretariat, United Nations Environmental Programme,1996,Other,,,,,,On Montreal protocal,,0910-AF18,Decision IX/19,,,Ozone Secretariat, United Nations Environmental Programme,1997,Other,,,,,,On Montreal protocal,,0910-AF18,Decision XII/2,,,Ozone Secretariat, United Nations Environmental Programme,2000,Other,,,,,,On Montreal protocal,,0910-AF18,Decision XIV/5,,,Ozone Secretariat, United Nations Environmental Programme,2002,Other,,,,,,On Montreal protocal,,0910-AF18,Decision XV/5,,,Ozone Secretariat, United Nations Environmental Programme,2003,Other,,,,,,On Montreal protocal,,0910-AF18,Ammendments to the Clean Air Act (Public Law 101-549),,,U.S. Congress,,Nov-90,Regulation,,,,,,,,0910-AF18,58 FR 65018,,,Environmental Protection Agency,,Dec-93,Regulation,,,,,,,,0910-AF18,40 CFR 82,,,Environmental Protection Agency,,,Regulation,,,,,,,,0910-AF18,62 FR 10242,,,Food and Drug Administration,,Mar-97,Regulation,,,,,,,,0910-AF18,64 FR 47719,,,Food and Drug Administration,,Sep-99,Regulation,,,,,,1999 proposed rule,,0910-AF18,67 FR 48370,,,Food and Drug Administration,,2-Jul,Regulation,,,,,,2002 final rule,,0910-AF18,67 FR 49396,,,Food and Drug Administration,,2-Jul,Regulation,,,,,,,,0910-AF18,67 FR 58678,,,Food and Drug Administration,,2-Sep,Regulation,,,,,,,,0910-AF18,NDA 20-503,,,Food and Drug Administration,,Aug-96,Government Report,,,,,,approved by Food and Drug Administration; companies behind the product is 3M Co. and Schering-Plough,,0910-AF18,NDA 20-983,,,Food and Drug Administration,,1-Apr,Government Report,,,,,,,,0910-AF18,Approved Drug Products with Therapeutic Equivalence Evaluations,,,Food and Drug Administration,,2005,Government Report,,,,,,"unsure on edition they are refrring to, so date is not concrete",,0910-AF18,60 FR 53725,,,Food and Drug Administration,,Oct-95,Regulation,,,,,,,,0910-AF18,61 FR 15699,,,Food and Drug Administration,,Apr-96,Regulation,,,,,,,,0910-AF18,Meeting of the Pulmonary-Allergy Drug Advisory Committee,,,Pulmonary-Allergy Drug Advisory Committee,Food and Drug Administration,4-Jun,Other,,,,,,"Meeting held for the committee: ""Presentations were made by 13 speakers representing patient advocacy groups, medical professional organizations, an industry organization, an environmental advocacy group, an economics consulting firm, GSK, Schering, Honeywell Chemicals (Honeywell), and IVAX""",,Mentions meeting several times through 0910-AF18,69 FR 26169,,,Food and Drug Administration,,4-May,Regulation,,,,,,,,0910-AF18,69 FR 31126,,,Food and Drug Administration,,4-Jun,Regulation,,,,,,,,0910-AF18,Citizen Petition of the U.S. Shareholders Group on MDI transition (Docket No. 03P-0029/CP1),,(Docket No. 03P-0029/CP1),Fran Du Melle,American Lung Association,3-Jan,Comment,,,,,,,,0910-AF18,Comment from GSK ,,(2003P -0029/C20),GlaxoSmithKline,,,Comment,,,,,,"Because of new docketing system as of 2008, hard to find comments with dates",,0910-AF18,Written Comment from Schering ,,(2003P -0029/C31),Schering,,4-Aug,Comment,,,,,,"Because of new docketing system as of 2008, hard to find comments with dates",,0910-AF18, NERA Comment ,,(2003P-0029/C25),National Economic Research Association,,4-Aug,Comment,,,,,,,,0910-AF18,Comment from GSK ,,(2003P-0029/CR1),GlaxoSmithKline,,4-Aug,Comment,,,,,,,,0910-AF18,Comment 11,,,GlaxoSmithKline,,,Comment,,,,,,,,0910-AF18,Comment 14,,,IVAX,,,Comment,,,,,,,,0910-AF18,Comment 17,,,GlaxoSmithKline,,,Comment,,,,,,,,0910-AF18,Drug Price Competition and Patent Term Restoration Act of 1984,,,U.S. Congress,,1984,Regulation,,,,,,,,0910-AF18,130 Cong. Rec. H9113-14 and H9121-22,,Food and Drug Administration,Henry Waxman,,Sep-84,Hearing,,,,,,,,0910-AF18,Medicare Prescription Drug Improvement and Modernization Act of 2003,,,U.S. Congress,,3-Dec,Regulation,,,,,,,,0910-AF18,Clean Air Act,,,,,,Regulation,,,,,,,,0910-AF18,Comment 37,,,Honeywell,,3-Jan,Regulation,,,,,,,,0910-AF18,World Meteorological Organization Global Ozone and Research Project--Report No. 47:  Scientific Assessment of Ozone Depletion:  2002,,,World Meteorological Organization,,2002,Non-Government Report,,,,,,,,0910-AF18,,,,drugstore.com,,2004,Website,,,,,,RIA writers found info from here,,0910-AF18,,,http://www.epa.gov/ozone/ods.html,Environmental Protection Agency,,,Website,,,,,,,,0910-AF18,,,,IMS Health,IMS MIDAS,2003,Other,,,,,,"""Analysis completed by FDA based on information provided by IMS Health, IMS MIDASTM, U.S., Germany, France and the United Kingdom, 2003",,0910-AF18,State Drug Utilization Data,,http://www.cms.hhs.gov/medicaid/drugs/drug5.asp for 2003,Center for Medicare and Medicaid Services,,2003,Website,,,,,,,,0910-AF18,Medicare Current Beneficiary Survey,,,Center for Medicare and Medicaid Services,,2001,Government Report,,,,,,,,0910-AF18,69 FR 46731,,,Food and Drug Administration,,4-Aug,RIA,,,,,,"As was noted in the impact analysis for the proposed rule on the Medicare prescription drug benefit (69 FR 46731, August 3, 2004)",,0910-AF18,1997 Economic Census,,,U.S. Census Bureau,,1997,Government Report,,,,,,,,,,,,,,,,,,,,,,,2060-AK70,EPA Guidelines for Preparing Economic Analyses ,,EPA 240-R-00-003,Environmental Protection Agency,,Sep-00,Government Report,,,,,,http://yosemite.epa.gov/ee/epa/eed.nsf/webpages/Guidelines.html,,2060-AK70,Annual Energy Outlook 2004 with Projections to 2025,,DOE/EIA-0383,Energy Information Administration,U.S. Department of Energy,2004,Government Report,,,,,,"http://www.eia.doe.gov/oiaf/archive/aeo04/index.html ; ""See Table A-2 and Supplemental Table 34""",,2060-AK70,Hearing Notice and Staff Report; Initial Statement of Reasons for Proposed Rule Making Public Hearing to Consider the Adoption of Portable Fuel Container Spillage Control Regulation,,,Air Resources Board,California Environmental Protection Agency,Aug-99,Government Report,,,,,,A copy of this document is available at http://www.arb.ca.gov/regact/spillcon/isor.pdf,,2060-AK70,Characterizing Gasoline Markets: A Profile,,EPA Contract No. 68-D-99-024,Research Triangle Institute,,4-Aug,Government Report,,,,,,"""Prepared for the U.S. EPA by RTI""",,2060-AK70,Characterizing Gas Can Markets: A Profile,,EPA Contract No. 68-D-99-024,Research Triangle Institute,,4-Aug,Government Report,,,,,,"""Prepared for the U.S. EPA by RTI""",,2060-AK70,OAQPS Economic Analysis Resource Document,,,Environmental Protection Agency,,1999,Government Report,,,,,,http://www.epa.gov/ttn/ecas/econdata/6807-305.pdf,,2060-AK70,Model Complexity and Scope for Policy Analysis,Public Administration Quarterly,,"Bingham, T.H.; Fox, T.J.",,1999,Article,,,,,,,,2060-AK70,Assessing the Employment Impacts,Environmental and Resource Economics,,"Berck, P; Hoffmann S.","Department of Agricultural and Resource Economics and Giannini Foundation, University of California Berkeley; Resources for the Future",2002,Scholarly Journal,10.1023/A:1015531702905, 0924-6460,"This paper provides an introductory guide for environmental and resource economists to methods of assessing the impact of environmental and natural resource policy on employment. It examines five basic approaches to evaluating the effect of a policy action on employment: 1) supply and demand analysis of the affected sector; 2) partial equilibrium analysis of multiple markets; 3) fixed-price, general equilibrium simulations (input-output (I-O) and social accounting matrix (SAM) multiplier models); 4) non-linear, general equilibrium simulations (Computable General Equilibrium (CGE) models); and 5) econometric estimation of the adjustment process, particularly time series analysis. The basic modeling structure and data requirements for each of these approaches are described. Simple examples of their application to evaluation of environmental and natural resource policy are developed and the relative merits and applicability of each are discussed.",,,Could not find funding sources http://download.springer.com.silk.library.umass.edu/static/pdf/444/art%253A10.1023%252FA%253A1015531702905.pdf?auth66=1426386021_29cc56075ea8a1d8b873c9eace97c812&ext=.pdf,,2060-AK70,Executive Analysis of Federal Regulations Under Executive Order 12866,,"Executive Office of the President, Office Management and Budget",Office Management and Budget,,Jan-96,Government Report,,,,,,http://www.whitehouse.gov/omb/inforeg/print/riaguide.html,,2060-AK70,Contestable Markets: An Uprising in the Theory of Industry Structure,American Economic Review,,"Baumol, W.",New York University,1982,Scholarly Journal,, 0002-8282,"The article reports on work that the author has done with his colleagues and writers, John Panzar and Robert Willig. This work has been encapsuled in their new book enables them to look at industry structure and behaviour in a way that is novel in a number of respects, that it provides a unifying analytical structure to the subject area and insights for empirical work and for the formulation of policy. Before getting into the substance of the analysis the author admits that this presidential address is most unorthodox in at least one significant respect-that it is not the work of a single author. Not only Panzar and Willig, but many others have made crucial contributions to the formulation of the theory. No uprising by a tiny band of rebels can hope to change an established order and when the time for rebellion is ripe it seems to break out simultaneously and independently in a variety of disconnected centers each offering its own program for the future. The author says that is tempting for him to take the view that their book is the true gospel of the rebellion and that the doctrines promulgated by others must be combatted as heresy.",,Economics Program of the Division of Social Sciences of the National Science Foundation; the Division of Information Science and Technology of the National Science Foundation;  the Sloan Foundation,Could not find doi; possible because of age of the article,,2060-AK70,Contestable Markets and the Theory of Industry Structure,,,"Baumol, W.; Panzer, J.; Willig, R.",,1982,Book,,,,,,,,2060-AK70,Marshallês Third Rule: A Further Comment,Oxford Economic Papers,,"Hicks, J.R.",,1961,Article,,,,,,,,2060-AK70,The Theory of Wages,,,"Hicks, J.R.",,1966,Book,,,,,,,,2060-AK70,Mathematical Analysis for Economists,,,"Allen, R.G.D.",,1938,Book,,,,,,,,2060-AK70,Highway Statistics 2002,,,U.S. Department of Transportation; Federal Highway Administration,,2002,Government Report,,,,,,A copy of this document can be found at http://www.fhwa.dot.gov/policy/ohim/hs02/index.htm,,2060-AK70,"Final Report of the Federal Trade Commission, Midwest Gasoline Price Investigation",,,Federal Trade Commission,,1-Mar,Government Report,,,,,,A copy of this report is available at http://www.ftc.gov/os/2001/03/mwgasrpt.htm,,2060-AK70,"Petroleum Marketing Annual, August 2004",,DOE/EIA-0487-2004,U.S. Department of Energy; Energy Information Administration,,5-Aug,Government Report,,,,,,A copy of this document is available at http://www.eia.doe.gov/pub/oil_gas/petroleum/data_publications/petroleum_marketing_annual/h istorical/2004/pdf/pmatab48.pdf,,2060-AK70,Annual Energy Outlook 2005 with Projections to 2025,,Report #: DOE/EIA-0383,U.S. Department of Energy; Energy Information Administration,,2005,Government Report,,,,,,,,2060-AK70,Calculation of Motor Gasoline Prices in MSAT_EIM,,EPA Contract No. 68-D-99-024,Research Triangle Institute,,5-Dec,Government Report,,,,,,"Memo to Chi Li, U.S. EPA, from Brooks Depro, RTI; ""Prepared for the U.S. EPA by RTI""",,2060-AK70,"Petroleum Marketing Annual, August 2004",,DOE/EIA-0487-2003,U.S. Department of Energy; Energy Information Administration,,2003,Government Report,,,,,,A copy of this document is available at http://tonto.eia.doe.gov/FTPROOT/petroleum/048703.pdf,,2060-AK70,Highway Statistics 2003,,,U.S. Department of Transportation; Federal Highway Administration,,2003,Government Report,,,,,,A copy of this document can be found at http://www.fhwa.dot.gov/policy/ohim/hs03/index.htm,,2060-AK70,Inventories and Market Power in the World Crude Oil Market,,,"Considine, T.J.","Department of Energy, Environmental, and Mineral Economics, The Pennsylvania State University",2002,Article,,,,,,A copy of this document is available at http://www.personal.psu.edu/faculty/c/p/cpw/resume/InventoriesMarketPowerinCrudeOilMarket s.pdf,,