RIN,Title,Journal ,Alternate Source,Author,Affiliation,Date,Type,DOI,ISSN ,Abstract,Government Funding,Funding Source,Notes,,2060-AK70,NBER-CES Manufacturing Industry Database,,,"Bartlesman, E., R. Becker, and W. Gray",National Bureau of Economic Research,2000,Database,,,,,,A copy of this document can be found at http://www.nber.org/nberces/nbprod96.htm,,2060-AK70,Tax Incidence,,NBER Working Paper 8829,"Fullerton, D.; Metcalf G.",National Bureau of Economic Research,2-Mar,Article,,,,,,"http://www.nber.org/papers/w8829. As obtained June 18, 2004.",,2060-AK70,Economic Benefits of Mitigating Refinery Disruptions: A Suggested Framework and Analysis of a Strategic Fuels Reserve,,P600-02-018D,"Finizza, A.",California Energy Commision,2-Jul,Government Report,,,,,,Study conducted for the California Energy Commission pursuant to California State Assembly Bill AB 2076; A copy of this document is available at http://www.energy.ca.gov/reports/2002-07-08_600-02-018D.PDF,,2060-AK70,Costs of Oil Dependence: A 2000 Update,,DE-AC05-00OR22725; ORNL/TM-2000/152,"Greene, D.L.; Tishchishyna N.I.",Oak Ridge National Laboratory,May-00,Government Report,,,,,,Study prepared by Oak Ridge National Laboratory for the U.S. Department of Energy; This document can be accessed at http://www.ornl.gov/~webworks/cpr/v823/rpt/107319.pdf.,,2060-AK70,Industry Profile for the Petroleum Refinery NESHAP,,"EPA Contract No. 68-D4-0107, WA No. II-17",Methtech; Pechan & Associates,,Feb-97,Government Report,,,,,,"Draft for EPA by Methtech and Pechan & Associates; http://www.epa.gov/ttnecas1/regdata/IPs/Petroleum%20Refinery%20(Sulfur%20Recovery%20U nits,%20Catalytic%20Crackin.pdf.",,2060-AK70,The Demand for Automobile Fuel: A Survey of Elasticities,Journal of Transport Economics and Policy ,,"Graham, D.; Glaister, S.","University of London Imperial College of Science, Technology, and Medicine",2002,Scholarly Journal,, 0022-5258,A survey is made of the international research on the response of motorists to fuel price changes and an assessment of the orders of magnitude of the relevant income and price effects. The paper highlights some new results and directions that have appeared in the literature. The evidence shows important differences between the long- and short-run price elasticities of fuel consumption.,,,Could not find DOI or funding sources from JSTOR,,2060-AK70,Gasoline Demand Elasticities Revisited: An International Meta-Analysis of Elasticities,Energy Economics,,"Espey, M.",University of Nevada,1998,Scholarly Journal,10.1016/S0140-9883(97)00013-3, 0140-9883,"Meta-analysis is used to determine if there are factors that systematically affect price and income elasticity estimates in studies of gasoline demand. Four econometric models are estimated, using long-run and short-run price and income elasticity estimates from previous studies as the dependent variables. Explanatory variables include functional form, lag structure, time span, national setting, estimation technique, and other features of the model structure. Elasticity estimates are found to be sensitive to the inclusion or exclusion of some measure of vehicle ownership. Static models appear to overestimate short-run elasticities, underestimate long-run price elasticities, but pick up the full long-run income responsiveness. There is variation in the elasticity of demand across countries, especially in the short-run, and gasoline demand appears to be getting more price-elastic and less income-elastic over time. (C) 1998 Elsevier Science B.V.",,University of Nevada Agricultural Experiment Station ,University of Nevada Agricultural Experiment Station Project No. 5138,,2060-AK70,Incidence of Federal and State Gasoline Taxes,Economics Letters,,"Chouinard, H.; Perloff, J.M.","Washington State University, Department of Agriculture and Resource Economics; University of California Berkeley, Department of Agriculture and Resource Economics",2004,Scholarly Journal,10.1016/j.econlet.2003.10.004, 0165-1765,The federal specific gasoline tax falls equally on consumers and wholesalers; whereas state specific taxes fall almost entirely on consumers. The consumer incidence of state taxes is greater in states that use relatively little gasoline. (C) 2003 Elsevier B.V. All rights reserved.,,,,,2060-AK70,Implicit Price Deflators for Gross Domestic Product,,BEA Quarterly,U.S. Bureau of Economic Analysis,,2004,Government Report,,,,,,A copy of this information can be found at http://www.bea.gov/bea/dn/nipaweb/SelectTable.asp,,2060-AK70, Final Regulatory Analysis for the Clean Air Nonroad Diesel Rule,,EPA 420-R-04-007,Environmental Protection Agency,,4-May,Regulation,,,,,,http://www.epa.gov/nonroad-diesel/2004fr/420r04007.pdf,,2060-AK70,"NBER-CES Manufacturing Industry Database, 1958 - 1996",,,National Bureau of Economic Research and U.S. Census Bureau; Center for Economic Research,,2002,Government Report,,,,,,http://www.nber.org/nberces/nbprod96.htm,,2060-AK70,Circular A-4,,,Office of Management and Budget,,3-Sep,Government Report,,,,,,,,,,,,,,,,,,,,,,,0910-AB76,The Economics of Blood and Where Blood Fits in the Overall Cost of Healthcare,,Transcript of DHHS Advisory Committee on Blood Safety and Availability,U.S. Department of Health and Human Services,,3-May,Government Report,,,,,,http://www.hhs.gov/bloodsafety/transcripts/0502bloo.pdf,,0910-AB76,Risk of Hepatitis and Retroviral Infections Among Blood Donors and Introduction of Nucleic Acid Testing (NAT),Developments in Biological,,"Dodd, R.Y.; Stramer, S.L.; Aberle-Grasse, J.; Notari, E.",,1999,Article,,,,,,"Advances in Transfusion Safety, International Symposium: Proceedings",,0910-AB76,Evaluation of the Effectiveness of Targeted Lookback for HCV Infection in the United States-Interim Results,Transfusion,,"Culver, D.H.; Alter, M.J.; Mullan, R.J.; Marigolis H.S.",Centers for Disease Control and Prevention,2000,Scholarly Journal,10.1046/j.1537-2995.2000.40101176.x,0041-1132,"BACKGROUND: As part of a nationwide program to identify persons at increased risk for HCV infection, persons who received blood from donors who later tested positive for anti-HCV are being directly notified. STUDY DESIGN AND METHODS: In December 1999, all 198 blood collection establishments (BCEs) and 5442 hospital transfusion services (TSs) in the United States were surveyed by mailed questionnaire to evaluate their progress in carrying out this notification. RESULTS: Eighty-one percent of the BCEs and 64 percent of the TSs responded. After correcting for nonresponse, an estimated 98,484 components at potential risk for transmitting HCV, according to previous testing of multiantigen-screened donors, were identified nationwide, of which 85 percent had been transfused to recipients. Lookback for these recipients was completed for 80 percent, of whom 69 percent had died. Of those living, 78 percent were successfully notified. An estimated 49.5 percent of those notified were tested, 18.9 percent of those tested were anti-HCV positive, and 32 percent of that group knew they were positive before notification. On the basis of an 85.5 percent reported completion rate for component notifications back through 1988, an estimated 1520 persons will have been newly identified as anti-HCV-positive when lookback related to multiantigen screening of donors is completed. ",,,"Acknowledges AABB Interorganizational Task Force for HCV Lookback; William Baine, MD, Agency for Healthcare Research and Quality; Toni Marie Nearing and Edward Tabor, MD, Food and Drug Administration",,0910-AB76,"Table 20. Private Industry Workers, Health Services, by Occupational Group: Employer Costs per Hour Worked for Employee Compensation and Costs as a Percent of Total Compensation, 1994- 2001",,,"U.S. Department of Labor, Bureau of Labor Statistics",,2002,Government Report,,,,,,ftp://ftp.bls.gov/pub/special.requests/ocwc/ect/ecechist.pdf,,0910-AB76,"Table 13. Private Industry Workers, Service-Producing Industries, by Occupational Group: Employer Costs per Hour Worked for Employee Compensation and Costs as a Percent of Total Compensation, 1988-2001",,,"U.S. Department of Labor, Bureau of Labor Statistics",,2002,Government Report,,,,,,ftp://ftp.bls.gov/pub/special.requests/ocwc/ect/ecechist.pdf,,0910-AB76,Retrospective Targeted HCV Lookback Using Centralized Contracted Notification Service,Transfusion,,"Saxena,S.; et al.",Los Angeles County; University of Southern California; University of California Los Angeles; Charles R. Drew University of Medicine and Science,2003,Scholarly Journal, 10.1046/j.1537-2995.2003.00421.x, 0041-1132,"BACKGROUND: Mandated HCV 2.0 lookback significantly challenged the human and financial resources available to the six Los Angeles County Department of Health Services (DHS) hospital blood banks. To comply with FDA requirements, DHS developed a centralized process that utilized the services of a contract vendor for performing HCV lookback. STUDY DESIGN AND METHOD: A DHS public health nurse acted as HCV lookback coordinator and as liaison with the vendor. Cases were electronically forwarded to the vendor, who then reviewed the patient's chart to obtain information necessary for tracking the patient through commercial databases. The vendor was responsible for notifying the recipient for pretest counseling and for providing documentation of all efforts. RESULTS: In total, 411 recipients were identified, of which, 168 cases were completed by the hospitals, 243 were forwarded to the vendor, 50 percent were deceased, 21 percent were contacted, and 28 percent could not be contacted, and 1 percent could not be located on any databases. The vendor contacted 35 of 66 cases that the hospitals had unsuccessfully attempted to contact. Of the cases forwarded to the vendor, 82 percent were completed on time. Delays were attributable to the vendor in less than 2 percent of cases. The cost per case forwarded to the vendor was $322. CONCLUSION: Utilizing a professional service to conduct HCV recipient notifications is an effective strategy for meeting FDA deadlines and for freeing transfusion service staff to perform critical functions. It remains to be seen whether such strategies offer a cost savings.",,,did not see a funding source,,0910-AB76,Hospital Statistics,,,"American Hospital Association; Healthcare InfoSource, Inc.",,1998,Book,,,,,,,,0910-AB76,"HCUPnet, Healthcare Cost and Utilization Project, 1997 National Statistics",,,U.S. Department of Health and Human Services; Agency for Healthcare Research and Quality,,1997,Government Report,,,,,,,,0910-AB76,US NAT yield: Where Are We After 2 Years?,Transfusion Medicine,,"Stramer, S.L.",American Red Cross,2002,Scholarly Journal,10.1046/j.1365-3148.2002.00387.x,1365-3148,"The US blood supply has been tested for human immunodeficiency virus-1 (HIV-1) and hepatitis C virus (HCV) using nucleic acid amplification testing (NAT) of pools of small number of samples since early 1999. Since the implementation of NAT under an investigational new drug (IND) application, the results for the yield and false positivity have been remarkably consistent for greater than 2 years of testing even among multiple programmes using two different test methodologies and manufacturers: Gen-Probe/Chiron transcription-mediated amplification (TMA) and Roche polymerase chain reaction. All programmes in the US and Canada use NAT as a criterion for cellular as well as frozen product release. The focus of this paper is to provide an update of the programmes in the US and Canada, provide data in support of p24 antigen replacement by HIV-1 NAT and discuss the projections of residual risk of HIV, HCV and hepatitis B virus (HBV) following NAT and the associated cost/benefit.",,,"Thanks are due to Sally Caglioti (Blood Systems Laboratories), D.M. Strong, PhD (Puget Sound Blood Center), Richard Gammon, MD (America's Independent Blood Centers) and Vito Scalia (Canadian Blood Service) for kindly sharing their NAT experience",,0910-AB76,Estimates of the Cost-Effectiveness of a Single Course of Interferon-alpha-2b in Patients with Histologically Mild Chronic Hepatitis C,Annals of Internal Medicine,,"Bennett, W.G.; Inoue, Y.; Beck, J.R.; et al.",University of Florida; Yamaguchi University; Tufts University; Tufts University New England Medical Center; Baylor College of Medicine,Nov-97,Scholarly Journal,,,"Background: Chronic hepatitis C is a major cause of illness and death in the United States. Interferon-alpha 2b can induce clinical, biochemical, and virologic remission in some patients with chronic hepatitis C, but the long-term cost-effectiveness of this treatment, particularly in patients with histologically mild disease, is unknown. Objective: To estimate the cost-effectiveness of interferon-alpha 2b in mild chronic hepatitis C. Design: Meta-analysis of five prospective trials and cost-effectiveness analysis. Projection of the clinical and economic outcomes expected from loss of hepatitis C virus was done by using a Markov simulation. The potential effect of uncertainty in the model assumptions was tested by using sensitivity analyses. Data Sources: Search of the MEDLINE database, opinions of expert panels, hospital cost data, and adjusted physician charges. Patients: Hypothetical cohorts with histologically mild chronic hepatitis C. Intervention: The model assumed a single 6-month course of recombinant interferon-alpha 2b. Measurements: Life expectancy, quality-adjusted life expectancy, costs, and marginal cost-effectiveness ratios from a managed care perspective. Results: In 27% of patients with mild chronic hepatitis C treated with interferon-alpha 2b for 6 months, serum alanine aminotransferase levels permanently returned to normal and viral status remained negative. The model estimated that interferon-alpha 2b treatment in this population should increase life expectancy by 3.1 years if given at 20 years of age, by 1.5 years at 35 years of age, and by 22 days at 70 years of age; discounted marginal cost-effectiveness ratios are $500, $1900, and $62 000 per year of life gained, respectively. Varying the long-term response rates and progression rates for mild and moderate chronic hepatitis to near zero in sensitivity analyses substantially affected the results: Ratios ranged from $31 000 for a 20-year-old patient to $640 000 for a 70-year-old patient. Conclusions: On the basis of estimations in this mathematical model of the natural history of chronic hepatitis C, treating mild chronic hepatitis with interferon-alpha 2b should prolong life expectancy at a reasonable marginal cost per year of life gained, particularly in younger patients.",,Schering-Plough Corp,ISSN is 0003-4819; the cell was malfunctioning could not find doi,,0910-AB76,Understudied Populations with Hepatitis C,Hepatology,,"Strader, D.B.",Veterans Affairs Medical Center; Georgetown University,2002,Scholarly Journal,10.1053/jhep.2002.36991,0270-9139,"Managing patients with hepatitis C virus (HCV) infection consists primarily of antiviral treatment, currently with peginterferon and ribavirin. Unfortunately, treatment recommendations derive largely from trials that have focused on highly selected patient populations. As a consequence of the strict inclusion and exclusion criteria in these studies, more than half of all HCV-infected patients would be ineligible for enrollment. Even among the selected patients enrolled into studies, only 50% achieve a sustained virological response (SVR). Patients not eligible for current therapies include those with mild disease and normal alanine aminotransferase (ALT) levels, patients with advanced and decompensated liver disease, children, the elderly, patients with ongoing or recent alcohol and substance abuse, renal disease, human immunodeficiency virus (HIV) infection, severe psychiatric or neurologic illness, autoimmune disorders, solid organ transplant, and other significant comorbid conditions. Because these patients have been excluded from most clinical trials, little is known about the safety or efficacy of therapy in these populations. The expense and side effects of therapy are also an impediment to treatment of patients who are on public assistance, in prisons, and in institutions. Clearly, new efforts and new approaches are needed to expand the eligibility for antiviral therapy of hepatitis C and make treatment more available for understudied populations with this disease. (Hepatology 2002;36:S226_S236).",,,could not find funding ,,0910-AB76,Cost-Effectiveness of 6 and 12 Months of Interferon-alpha Therapy for Chronic Hepatitis C,Annals of Internal Medicine,,"Kim, W.R.; Poterucha, J.J.; Hermans, J.E.; et al.",Mayo Clinic and Mayo Foundation,Nov-97,Scholarly Journal,, 0003-4819,"Background: Interferon-alpha is effective in only a small number of patients with chronic hepatitis C, although prolonged treatment may increase the response rate. There is concern that the expense of interferon-alpha therapy may not be justified by the low response rates and uncertain long-term benefit. Objective: To compare clinical and economic outcomes after 6 months and 12 months of interferon-alpha therapy for chronic hepatitis C. Design: A Markov model depicting the natural progression of chronic hepatitis C. On the basis of this model, a simulated trial compared no therapy with 6 and 12 months of interferon-alpha therapy at standard doses (3 million U three times weekly). Patients: Four age-specific cohorts (30, 40, 50, and 60 years of age) with chronic hepatitis C. Measurements: Number of deaths from liver disease, total costs, and cumulative quality-adjusted life-years (QALYs). Results: Six and 12 months of interferon-alpha treatment gained 0.25 QALYs at an incremental cost of $1000 and 0.37 QALYs at an incremental cost of $1900, respectively. Thus, although 6 months of interferon-alpha therapy was less efficacious than 12 months of therapy, it was more cost-effective ($4000 per QALY gained compared with $5000 per QALY gained). Nonetheless, in patients younger than 60 years of age, both 6 and 12 months of therapy compared favorably with other established medical interventions, such as screening mammography and cholesterol reduction programs. Important variables affecting the cost-effectiveness of interferon-alpha treatment included the cost and efficacy of interferon-alpha, the cost of treatment for decompensated cirrhosis, and quality of life in patients with chronic hepatitis C. Conclusion: From the standpoint of cost-effectiveness, interferon-alpha therapy for 6 or 12 months may be justified in patients with chronic hepatitis C. The possible exception is patients older than 60 years of age.",,"National Institutes for Health,  grant DK34238",,,0910-AB76,Cost-effectiveness of Treatment for Chronic Hepatitis C Infection in an Evolving Patient Population,Journal of the American Medical Association,,"Salomon, J.A.; Weinstein, M.C.; Hammitt, J.K.; Goldie, S.J.",Harvard University; World Health Organization,3-Jul,Scholarly Journal,10.1001/jama.290.2.228,0098-7484,"Context Approximately 2.7 million US individuals are chronically infected with the hepatitis C virus (HCV). As public health campaigns are pursued, a growing number of treatment candidates are likely to have minimal evidence of liver damage. Objective To examine the clinical benefits and cost-effectiveness of newer treatments for chronic hepatitis C infection in a population of asymptomatic, HCV seropositive but otherwise healthy individuals. Design and Setting Cost-effectiveness analysis using a Markov model of the natural history of HCV infection and impact of treatment. We used an epidemiologic model to derive a range of natural history parameters that were empirically calibrated to provide a good fit to observed data on both prevalence of HCV seropositivity and time trends in outcomes related to HCV infection. Patients Cohorts of 40-year-old men and women with elevated levels of alanine aminotransferase, positive results on quantitative HCV RNA assays and serologic tests for antibody to HCV, and no histological evidence of fibrosis on liver biopsy. Interventions Monotherapy with standard or pegylated interferon alfa-2b; combination therapy with standard or pegylated interferon plus ribavirin. Main Outcome Measures Lifetime costs, life expectancy, quality-adjusted life-years (QALYs), and incremental cost-effectiveness ratios. Results The probability of patients with chronic HCV developing cirrhosis over a 30-year period ranged from 13% to 46% for men and from 1% to 29% for women. The incremental cost-effectiveness of combination therapy with pegylated interferon for men ranged from $26000 to $64000 per QALY for genotype 1 and from $10000 to $28000 per QALY for other genotypes; and for women ranged from $32000 to $90000 for genotype 1 and from $12000 to $42000 for other genotypes. Because the benefits of treatment were realized largely in the form of improvements in health-related quality of life, rather than prolonged survivorship, cost-effectiveness ratios expressed as dollars per year of life were substantially higher. Results were most sensitive to assumptions about the gains and decrements in health-related quality of life associated with treatment. Conclusions While newer treatment options for hepatitis C appear to be reasonably cost-effective on average, these results vary widely across different patient subgroups and depend critically on quality-of-life assumptions. As the pool of persons eligible for treatment for HCV infection expands to the more general population, it will be imperative for patients and their physicians to consider these assumptions in making individual-level treatment decisions.",,,could not find funding,,0910-AB76,Cost Effectiveness of Interferon alpha _2b Combined with Ribavirin for the Treatment of Chronic Hepatitis C,Hepatology,,"Younossi, Z.M., Singer, M.E.; McHutchison, J.G.; Shermock, K.M.",Cleveland Clinic Foundation; Case Western Reserve University; Scripps Reasearch Institute ,1999,Scholarly Journal,10.1002/hep.510300518,0270-9139,"Treatment of chronic hepatitis C with Interferon (IFN) alpha 2b monotherapy results in 10% to 15% sustained virological response (SVR). Combining IFN with ribavirin increases this response. In this analysis, using the Markov model, 6 treatment strategies for chronic hepatitis C (previously untreated) were compared on the basis of incremental cost per additional quality-adjusted life years ($/QALY). Our results showed that the no treatment strategy was associated with a cost of $38,747 and 13.10 QALYs, The strategy using IFN alone for 48 weeks was associated with a cost of $35,642 and 14.05 QALYs. The strategy using IFN monotherapy followed by combination therapy for nonresponders and relapsers was associated with a cost: of $34,561 and 15.53 QALYs. A similar strategy, but limiting combination to relapsers only, was associated with a cost of $34,758 and 14.40 QALYs. The strategy using IFN with ribavirin as the initial therapy for all patients was associated with a cost of $34,792 and 15.31 QALYs. Finally the strategy using viral genotyping first and then adjusting. the duration of combination therapy based on genotype was associated with a cost of $37,263 and 15.89 QALYs. The strategy using genotyping to guide duration of combination therapy was the most cost-effective approach with an incremental cost-effectiveness ratio of $7,500 per QALY. Sensitivity analyses confirmed the robustness of these results. We conclude that combination of IFN and ribavirin with duration of therapy based on the viral genotype, is a cost-effective approach in treating patients with chronic hepatitis C.",,,could not find funding,,0910-AB76,Clinical Laboratory Fee Schedule for CY2003,,,U.S. Department of Health and Human Services; Centers for Medicare and Medicaid Services,,2003,Government Report,,,,,,,,0910-AB76,"HCUPnet, Healthcare Cost and Utilization Project, 2001 National Statistics--Cross-Classifying Diagnoses or Procedures",,,U.S. Department of Health and Human Services; Agency for Healthcare Research and Quality,,2001,Government Report,,,,,,,,0910-AB76,2003 Medicare Physician Fee Schedule (MPFS),,,U.S. Department of Health and Human Services; Centers for Medicare and Medicaid Services,,2003,Government Report,,,,,,,,0910-AB76,Valuing Health for Regulatory Cost- Effectiveness Analysis,,,Institute of Medicine,,2006,Non-Government Report,,,,,,,,0910-AB76,Measuring the Health of the U.S. Population,"Brookings Papers on Economic Activity, Microeconomics",,"Cutler, David M.; Richardson, Elizabeth",,1997,Article,,,,,,,,0910-AB76,The Value of a Statistical Life: A Critical Review of Market Estimates throughout the World,Journal of Risk and Uncertainty,,"Viscusi, W. Kip; Aldy, Joseph E.",Harvard University,2003,Scholarly Journal,10.1023/A:1025598106257, 0895-5646,"A substantial literature over the past thirty years has evaluated tradeoffs between money and fatality risks. These values in turn serve as estimates of the value of a statistical life. This article reviews more than 60 studies of mortality risk premiums from ten countries and approximately 40 studies that present estimates of injury risk premiums. This critical review examines a variety of econometric issues, the role of unionization in risk premiums, and the effects of age on the value of a statistical life. Our meta-analysis indicates an income elasticity of the value of a statistical life from about 0.5 to 0.6. The paper also presents a detailed discussion of policy applications of these value of a statistical life estimates and related issues, including risk-risk analysis.",,"Harvard Olin Center for Law, Business, and Economics; Environmental Protection Agency; Environmental Protection Agency STAR Fellowship program",,,